{
  "schema_version": 1,
  "id": "MS-ACME-CLOUD-001",
  "project_id": "ACME-CLOUD",
  "name": "OrderHub live on Northwind",
  "description": "First of the three application cutovers complete and soaking. This is the gate that proves the migration approach before Billing and Reporting follow.",
  "target_date": "2026-09-15",
  "baseline_date": "2026-09-01",
  "actual_date": null,
  "status": "at-risk",
  "gate": true,
  "gate_criteria": [
    "OrderHub serving production traffic from Northwind",
    "Rollback path tested and signed off",
    "No P1 incidents in the first 72 hours"
  ],
  "owner": { "party": "internal", "person": "Sarah Chen", "contact_id": "CONTACT-INTERNAL-sarah-chen" },
  "deliverables": ["DLV-ACME-CLOUD-001"],
  "action_cards": ["SC-ACME-CLOUD-0001", "SC-ACME-CLOUD-0002"],
  "tags": ["cutover", "gate"]
}
